{
  "schema_version": "foi-o-nz.run-manifest.v0.2.0",
  "created_at": "2026-07-01T00:00:00Z",
  "software": {
    "name": "foi-o-nz",
    "version": "0.2.0"
  },
  "command": "normalise-manifest",
  "environment": {
    "python": "3.13.5",
    "platform": "example"
  },
  "input": {
    "path": "data/raw/fyi-manifest.jsonl",
    "bytes": 1234,
    "sha256": "aaaaaaaaaaaaaaaaaaaaaaaaaaaaaaaaaaaaaaaaaaaaaaaaaaaaaaaaaaaaaaaa"
  },
  "outputs": [
    {
      "path": "data/processed/requests.jsonl",
      "bytes": 2345,
      "sha256": "bbbbbbbbbbbbbbbbbbbbbbbbbbbbbbbbbbbbbbbbbbbbbbbbbbbbbbbbbbbbbbbb"
    },
    {
      "path": "data/processed/events.jsonl",
      "bytes": 3456,
      "sha256": "cccccccccccccccccccccccccccccccccccccccccccccccccccccccccccccccc"
    }
  ],
  "counts": {
    "requests": 1,
    "events": 3
  }
}
